{
  "word": "",
  "language": "rki",
  "script": "Mymr",
  "pos": "",
  "definitions": [],
  "pronunciation": {
    "ipa": "",
    "romanization": "",
    "variants": []
  },
  "examples": [],
  "semantic_relations": {
    "synonyms": [],
    "antonyms": [],
    "related": []
  },
  "metadata": {
    "source": "",
    "tags": [],
    "updated_at": ""
  }
}
