{
  "word": "ငါ",
  "language": "rki",
  "script": "Mymr",
  "pos": "pronoun",
  "definitions": [
    {
      "sense_id": "1",
      "gloss": "I / me",
      "english": "I",
      "myanmar": "ငါ"
    }
  ],
  "pronunciation": {
    "ipa": "ŋɑ́",
    "romanization": "ngar",
    "variants": []
  },
  "examples": [
    {
      "sentence": "ငါ စားနိန်ရေ။",
      "translation": {
        "english": "I am eating.",
        "myanmar": "ငါ စားနေတယ်။"
      }
    }
  ],
  "semantic_relations": {
    "synonyms": [],
    "antonyms": [""],
    "related": []
  },
  "metadata": {
    "source": "native_speaker",
    "tags": ["pronoun"],
    "updated_at": "2025-12-12"
  }
}
