{
  "word": "အၞာေ",
  "language": "rki",
  "script": "Mymr",
  "pos": "noun",
  "definitions": [
    {
      "sense_id": "1",
      "gloss": "water",
      "english": "water",
      "myanmar": "ရေ"
    }
  ],
  "pronunciation": {
    "ipa": "aː.mɛ",
    "romanization": "amae",
    "variants": []
  },
  "examples": [
    {
      "sentence": "အၞာေ မအိုးသၠူ။",
      "translation": {
        "english": "The water is boiling.",
        "myanmar": "ရေနေပျုပ်တယ်။"
      }
    }
  ],
  "semantic_relations": {
    "synonyms": [],
    "antonyms": ["မၞာ်"],
    "related": []
  },
  "metadata": {
    "source": "native_speaker",
    "tags": ["basic"],
    "updated_at": "2025-12-12"
  }
}
